{
  "categories": [],
  "created_at": "2020-01-05 13:42:28.143137",
  "icon_url": "https://api.chucknorris.io/img/avatar/chuck-norris.png",
  "id": "XsZF_OwkSK2dXb7Cuzubmg",
  "updated_at": "2020-01-05 13:42:28.143137",
  "url": "https://api.chucknorris.io/jokes/XsZF_OwkSK2dXb7Cuzubmg",
  "value": "Chuck Norris can divide by zero."
}
